{
  "baselines": {
    "agentic-v0.5-frozen": {
      "metrics": {
        "action_owner_correctness": {
          "denominator": 2,
          "numerator": 0,
          "status": "evaluable",
          "value": 0.0
        },
        "advantage_over_naive_positive_resolution": {
          "denominator": 5,
          "numerator": 1,
          "status": "evaluable",
          "value": 0.2
        },
        "candidate_induced_correctness": {
          "denominator": 5,
          "numerator": 5,
          "status": "evaluable",
          "value": 1.0
        },
        "cross_repository_resolution": {
          "denominator": 1,
          "numerator": 0,
          "status": "evaluable",
          "value": 0.0
        },
        "false_owner_accusation_rate": {
          "denominator": 20,
          "numerator": 0,
          "status": "evaluable",
          "value": 0.0
        },
        "historical_positive_resolution": {
          "denominator": 5,
          "numerator": 1,
          "status": "evaluable",
          "value": 0.2
        },
        "median_substantive_experiments": {
          "denominator": 1,
          "numerator": 2,
          "status": "evaluable",
          "value": 2.0
        },
        "premature_owner_accusations": {
          "denominator": 20,
          "numerator": 0,
          "status": "evaluable",
          "value": 0.0
        },
        "safety_abstention_recall": {
          "denominator": 20,
          "numerator": 20,
          "status": "evaluable",
          "value": 1.0
        },
        "semantic_ambiguity_handling": {
          "denominator": 1,
          "numerator": 1,
          "status": "evaluable",
          "value": 1.0
        },
        "useful_experiment_rate": {
          "denominator": 40,
          "numerator": 30,
          "status": "evaluable",
          "value": 0.75
        }
      },
      "status": "EXECUTED"
    },
    "naive-deterministic": {
      "metrics": {
        "action_owner_correctness": {
          "denominator": 2,
          "numerator": 0,
          "status": "evaluable",
          "value": 0.0
        },
        "advantage_over_naive_positive_resolution": {
          "denominator": 5,
          "numerator": 0,
          "status": "evaluable",
          "value": 0.0
        },
        "candidate_induced_correctness": {
          "denominator": 5,
          "numerator": 5,
          "status": "evaluable",
          "value": 1.0
        },
        "cross_repository_resolution": {
          "denominator": 1,
          "numerator": 0,
          "status": "evaluable",
          "value": 0.0
        },
        "false_owner_accusation_rate": {
          "denominator": 20,
          "numerator": 10,
          "status": "evaluable",
          "value": 0.5
        },
        "historical_positive_resolution": {
          "denominator": 5,
          "numerator": 0,
          "status": "evaluable",
          "value": 0.0
        },
        "median_substantive_experiments": {
          "denominator": 1,
          "numerator": 2,
          "status": "evaluable",
          "value": 2.0
        },
        "premature_owner_accusations": {
          "denominator": 20,
          "numerator": 10,
          "status": "evaluable",
          "value": 0.5
        },
        "safety_abstention_recall": {
          "denominator": 20,
          "numerator": 10,
          "status": "evaluable",
          "value": 0.5
        },
        "semantic_ambiguity_handling": {
          "denominator": 1,
          "numerator": 0,
          "status": "evaluable",
          "value": 0.0
        },
        "useful_experiment_rate": {
          "denominator": 50,
          "numerator": 30,
          "status": "evaluable",
          "value": 0.6
        }
      },
      "status": "EXECUTED"
    },
    "static-v0.4": {
      "metrics": {
        "action_owner_correctness": {
          "denominator": 2,
          "numerator": 0,
          "status": "evaluable",
          "value": 0.0
        },
        "advantage_over_naive_positive_resolution": {
          "denominator": 5,
          "numerator": 0,
          "status": "evaluable",
          "value": 0.0
        },
        "candidate_induced_correctness": {
          "denominator": 5,
          "numerator": 5,
          "status": "evaluable",
          "value": 1.0
        },
        "cross_repository_resolution": {
          "denominator": 1,
          "numerator": 1,
          "status": "evaluable",
          "value": 1.0
        },
        "false_owner_accusation_rate": {
          "denominator": 20,
          "numerator": 0,
          "status": "evaluable",
          "value": 0.0
        },
        "historical_positive_resolution": {
          "denominator": 5,
          "numerator": 4,
          "status": "evaluable",
          "value": 0.8
        },
        "median_substantive_experiments": {
          "denominator": 1,
          "numerator": 0,
          "status": "evaluable",
          "value": 0.0
        },
        "premature_owner_accusations": {
          "denominator": 20,
          "numerator": 0,
          "status": "evaluable",
          "value": 0.0
        },
        "safety_abstention_recall": {
          "denominator": 20,
          "numerator": 20,
          "status": "evaluable",
          "value": 1.0
        },
        "semantic_ambiguity_handling": {
          "denominator": 1,
          "numerator": 0,
          "status": "evaluable",
          "value": 0.0
        },
        "useful_experiment_rate": {
          "denominator": 0,
          "numerator": 0,
          "status": "not_evaluable",
          "value": null
        }
      },
      "status": "EXECUTED"
    }
  },
  "candidate_gold_separation": {
    "gold_visible_to_candidate": false,
    "historical_evidence_visible_to_candidate": false,
    "labels_loaded_after_execution": true,
    "reference_used_as_runtime_evidence": false
  },
  "canonical_reproduction": {
    "reference_used_as_runtime_evidence": false,
    "status": "CORRECTED_SUITE_REFERENCE_MATCH"
  },
  "case_predictions": {
    "agentic-v0.5-frozen": [
      {
        "action_owner_repository": null,
        "candidate_induced": true,
        "case_id": "RADAR-V07-A01",
        "root_cause_component": null,
        "state": "BOUNDED_INCONCLUSIVE",
        "substantive_experiments": 2
      },
      {
        "action_owner_repository": null,
        "candidate_induced": true,
        "case_id": "RADAR-V07-A02",
        "root_cause_component": null,
        "state": "BOUNDED_INCONCLUSIVE",
        "substantive_experiments": 2
      },
      {
        "action_owner_repository": null,
        "candidate_induced": true,
        "case_id": "RADAR-V07-A03",
        "root_cause_component": null,
        "state": "BOUNDED_INCONCLUSIVE",
        "substantive_experiments": 2
      },
      {
        "action_owner_repository": null,
        "candidate_induced": true,
        "case_id": "RADAR-V07-A04",
        "root_cause_component": null,
        "state": "BOUNDED_INCONCLUSIVE",
        "substantive_experiments": 2
      },
      {
        "action_owner_repository": null,
        "candidate_induced": true,
        "case_id": "RADAR-V07-A05",
        "root_cause_component": null,
        "state": "BOUNDED_INCONCLUSIVE",
        "substantive_experiments": 2
      },
      {
        "action_owner_repository": null,
        "candidate_induced": null,
        "case_id": "RADAR-V07-T01",
        "root_cause_component": null,
        "state": "BOUNDED_INCONCLUSIVE",
        "substantive_experiments": 1
      },
      {
        "action_owner_repository": null,
        "candidate_induced": null,
        "case_id": "RADAR-V07-T02",
        "root_cause_component": null,
        "state": "BOUNDED_INCONCLUSIVE",
        "substantive_experiments": 1
      },
      {
        "action_owner_repository": null,
        "candidate_induced": null,
        "case_id": "RADAR-V07-T03",
        "root_cause_component": null,
        "state": "BOUNDED_INCONCLUSIVE",
        "substantive_experiments": 1
      },
      {
        "action_owner_repository": null,
        "candidate_induced": null,
        "case_id": "RADAR-V07-T04",
        "root_cause_component": null,
        "state": "BOUNDED_INCONCLUSIVE",
        "substantive_experiments": 1
      },
      {
        "action_owner_repository": null,
        "candidate_induced": null,
        "case_id": "RADAR-V07-T05",
        "root_cause_component": null,
        "state": "BOUNDED_INCONCLUSIVE",
        "substantive_experiments": 1
      },
      {
        "action_owner_repository": null,
        "candidate_induced": null,
        "case_id": "RADAR-V07-T06",
        "root_cause_component": null,
        "state": "BOUNDED_INCONCLUSIVE",
        "substantive_experiments": 1
      },
      {
        "action_owner_repository": null,
        "candidate_induced": null,
        "case_id": "RADAR-V07-T07",
        "root_cause_component": null,
        "state": "BOUNDED_INCONCLUSIVE",
        "substantive_experiments": 1
      },
      {
        "action_owner_repository": null,
        "candidate_induced": null,
        "case_id": "RADAR-V07-T08",
        "root_cause_component": null,
        "state": "BOUNDED_INCONCLUSIVE",
        "substantive_experiments": 1
      },
      {
        "action_owner_repository": null,
        "candidate_induced": true,
        "case_id": "RADAR-V07-T09",
        "root_cause_component": null,
        "state": "BOUNDED_INCONCLUSIVE",
        "substantive_experiments": 2
      },
      {
        "action_owner_repository": null,
        "candidate_induced": true,
        "case_id": "RADAR-V07-T10",
        "root_cause_component": null,
        "state": "BOUNDED_INCONCLUSIVE",
        "substantive_experiments": 2
      },
      {
        "action_owner_repository": null,
        "candidate_induced": true,
        "case_id": "RADAR-V07-T11",
        "root_cause_component": null,
        "state": "BOUNDED_INCONCLUSIVE",